Institution_Name,Area,Other,Primary_Contact_Name,Primary_Contact_Phone_Number,Primary_Contact_Email,Mailing_Address,website,Secondary_Contact_Name,Secondary_Contact_Email,Social_Media_Handles,Zoom_Team_Link,Zoom_Teams_Link,Video_Link,special_needs_or_requests
"School of Health Professions, University of Texas Medical Branch at Galveston","Clinical Laboratory Science,Occupational Therapy,Physical Therapy,Other (please specify):",Respiratory Care and Nutrition and Metabolism,Michelle Conley,409-772-3006,maconley@utmb.edu,"UTMB School of Health Professions 301 University Blvd. Galveston, TX  77555-1136",https://shp.utmb.edu/,,,"Facebook https://www.facebook.com/SHPUTMB, Twitter @SHPUTMB. Instagram shputmb","Zoom or Teams Link (for your virtual tabling),Introductory Video Link",https://zoom.us/j/8072741972?pwd=aUFCQ3FwdHlOTEgvcmFLUW50QmRjZz09 ,Will send video after the holiday break., Zoom Meeting Info Meeting ID: 807 274 1972 Passcode: 722486
Texas Tech Army ROTC,"Clinical Laboratory Science,Dental,Medicine,Nursing,Occupational Therapy,Optometry,Pharmacy,Physical Therapy,Physician Assistant,Speech, Language and Hearing Sciences,Other (please specify):",All Health Professions,Mr. George Hampton,806-834-5018,george.hampton@ttu.edu,3003 15th Street,"https""//www.depts.ttu.edu/armyrotc",Kelly Simpson,806-834-5018,https://www.facebook.com/TexasTechROTC,,,,N/A
Texas Tech University Health Sciences Center School of Health Professions,"Clinical Laboratory Science,Occupational Therapy,Physical Therapy,Physician Assistant,Speech, Language and Hearing Sciences",,Breanna Case,8067433220,breanna.case@ttuhsc.edu,"3601 4th St Lubbock, TX 79430",https://www.ttuhsc.edu/health-professions/,Liza Tijerina,liza.tijerina@ttuhsc.edu,"https://www.facebook.com/ttuhsc.shp/  
https://www.instagram.com/ttuhsc_shp/ 
https://twitter.com/ttuhsc_shp  
https://www.linkedin.com/company/ttuhsc-school-of-health-professions ","Zoom or Teams Link (for your virtual tabling),Introductory Video Link", https://ttuhscshp.zoom.us/j/94550171116,https://youtu.be/xJ_6cgFPyqU,
United States Air Force Health Professions Recruiting ,"Dental,Medicine,Nursing,Occupational Therapy,Optometry,Pharmacy,Physical Therapy,Physician Assistant",,TSgt Ashley Hicks ,7204027973,ashley.hicks@us.af.mil,5350 S roslyn st greenwood village CO 80111,Airforce.com,,,,,https://nam04.safelinks.protection.outlook.com/?url=https%3A%2F%2Fwww.zoomgov.com%2Fj%2F16155673289&amp;data=04%7C01%7CAmy.Perez%40ttu.edu%7Ccecca26454974ca418ad08d8b28dffcf%7C178a51bf8b2049ffb65556245d5c173c%7C0%7C0%7C637455670282770028%7CUnknown%7CTWFpbGZsb3d8eyJWIjoiMC4wLjAwMDAiLCJQIjoiV2luMzIiLCJBTiI6Ik1haWwiLCJXVCI6Mn0%3D%7C1000&amp;sdata=i6fqITkTDtgT2eWF%2FsAIHCa6x3X3zJ%2F78W9%2FnSsbpCg%3D&amp;reserved=0,,NA
University of St. Augustine,"Occupational Therapy,Physical Therapy,Speech, Language and Hearing Sciences",,Parlene Lopez,7604105364,Plopez@usa.edu,700 Windy Point Ln.,usa.edu,Samuel Wheeler,swheeler@usa.edu,"https://www.facebook.com/universityofstaugustine/, https://www.instagram.com/uofstaug/?hl=en, https://twitter.com/uofstaug?ref_src=twsrc%5Egoogle%7Ctwcamp%5Eserp%7Ctwgr%5Eauthor",,https://zoom.us/j/93552750301,,no
University of Texas Health San Antonio School of Health Professions,"Clinical Laboratory Science,Occupational Therapy,Physical Therapy,Physician Assistant,Speech, Language and Hearing Sciences",,Kirk Fallin,2105676220,fallin@uthscsa.edu,"7703 Floyd Curl Drive, Mail Code 7717, San Antonio, Texas 78229-3900",https://www.uthscsa.edu/,Melina Benavidez,benavidezm2@uthscsa.edu,"https://www.facebook.com/UTHealthSASHP
instagram: @uthealthsa_shp",,,,No
University of Texas Rio Grande Valley,Occupational Therapy,,Roel Garcia ,956-665-2475  Ext. 2952,roel.garcia03@utrgv.edu,"1201 W. University Drive, Edinburg, TX 78539",https://www.utrgv.edu/ot/,Thelma Ochoa,thelma.ochoa@utrgv.edu,,,https://utrgv.zoom.us/j/8762333930,https://utrgv.zoom.us/rec/share/mFp7S07QTVoWMtlGkexFGi7IrmMG2vSAlXzzLcY_4YC3rOEE_1EF4P2X_lraMlaD._8jLD4EL2cm9obfu,
